{"$schema":"https://json-schema.org/draft/2020-12/schema","title":"Boris Astro completed import manifest evidence v1","type":"object","required":["format","schema_version","project_id","policy_digest","records"],"properties":{"format":{"const":"boris-astro-import-manifest"},"schema_version":{"const":1},"project_id":{"type":"string"},"policy_digest":{"type":"string","pattern":"^[0-9a-f]{64}$"},"records":{"type":"array","items":{"type":"object","required":["source_path","import_record_id"],"properties":{"source_path":{"type":"string"},"import_record_id":{"type":"string","pattern":"^air_[0-9a-f]{64}$"}}}}}}
