{"format":"boris-astro-import-manifest","schema_version":1,"project_id":"schema-fixture","policy_digest":"034ae9dfa4ec47ad0a6cf2629eee2095df3ec41324d0912fa93462aaa7ba15c8","records":[{"source_path":"valid.md","import_record_id":"air_6114d1426b8842468af53bbf9438d73ef1b33ecf47a74c81d042a82d9ee750b7"}]}
